{
    "object": "consensus",
    "action": "learn",
    "message_id": "6z1k9Eqet9-YAOdEE9NaIQMvw8_W_Fj-u2vRL4siIb0=",
    "acceptors": [
        "pFFLRiOVyFX2UwFw8kd8PnVg6rshT-ofWYVAc_QuRz4=",
        "cSaSHaZzvVR_sfcD5xngSxafK1eCDxmrd0d1C7-VHXJ=",
        "OtP_nVgrshTofWYVAcQ-uRz44UD_2tFJUOLLvTbFmzO="
    ]
}
